,comments,dateStamp
967,"Believe with heart that Jesus Christ died for your sins on the cross and that GOD raised him from the dead 3 days later and ascended to heaven.And you are saved.Repent with your heart from your sins and accept him as Lord and Savior.Have faith and trust in him, he loves you and he awaits you to come to him, he will guide and change your life.This is to be with him as he cares for you.Feel free to share this message with others",2021-05-28T01:02:41Z
968,Vaccines aren't safe or effective,2021-05-27T23:46:06Z
969,"Nuremberg Code=The Great Reset

We are the Experiment",2021-05-27T21:53:37Z
970,"Talking about heart issues after taking a vaccine for a virus that has a 99.6% recovery rate... Here is a small suggestion, the media should talk About what Americans put in their bodies every day that causes the number 1 cause of death which is heart disease and lung cancer. Keep up the Good work on pushing fear.",2021-05-27T04:54:12Z
971,"Well, my son just turned 24 and the vaccine hurt his heart. His doctors got a hold of the CDC. I would never let my kids 30 and under.  Do you want to pay for all his doctor bills and his paychecks that he didn't get fir a month. He is a father of 3 young kids. Im going to post every where that goes public telling parents not to get their children vaccine.  Its horrible at age 24 now have a bad heart and will for the rest of his life. Stop forcing young people to get the vaccine.  Someone needs to stand up for our children",2021-05-27T03:31:14Z
972,"Let's pretend you can be protected from this virus by eating a strawberry.    
OMG!   Tucker Carlson says a few people are allergic to them SO DON'T EAT STRAWBERRIES !   STRAWBERRIES ARE DANGEROUS!
Making a big deal about a handful of cases out of hundreds of millions of problem-free vaccinations just shows you have no concept of math or probability...
...or it's just political fear-mongering.
Only a clueless idiot would think the vaccine is more dangerous than the virus.
DO THE MATH.",2021-05-27T02:09:13Z
973,Thank God I don't take it😀,2021-05-27T00:09:18Z
974,They are killing children!!!! Wake up!!!,2021-05-26T21:13:01Z
975,"The vaccine will cause 100% death, just a matter of time!",2021-05-26T20:46:50Z
976,"Here's the UK government & drug companies agreement w/big tech to delete all indication that goes against the mass cov id vascinations pro_paganda. Most big tech headquarters in USA. Med_icines and Health_care products Regulatory Agency ( M_HRA ), requesting help from Big tech companies to use AI to remove any content that speak about co vid vasvine ad_verse reactions (severe life threatening ill_nesses that develop afterwards long term),  because they predict the volume over months/years will be too high for them to cen,sor. 

This pro poganda was done before the mass vacc ination test rollout so people will buy into the pro paganda and go get it because the internet is parsing out content that doesn't support the d,rug companies. Also, delete information that goes against the vacsination such as ways to cure/recover from co vid like iver_mectin, etc. That way only d,octors/media who drank the koolaid can advise people. Risk vs Benefit logic compromised. 

MHRA 
https://ted.europa.eu/udl?uri=TED:NOTICE:506291-2020:TEXT:EN:HTML&tabld=1

The NIH just started the cov_id vasx trials (April, '21) to evaluate severe life threatening illneses that develop after getting the vascine with 2/3 being women w/history of all,ergies. The experiment will only monitor for 7 days before reporting its findings regarding the safety of the vacsines to the public. So, why the mass vascinations when the tests just began? Is 7 days enough time to evaluate long term safety?

https://www.nih.gov/news-events/news-releases/nih-begins-study-allergic-reactions-moderna-pfizer-biontech-covid-19-vaccines#:~:text=The%20Moderna%20and%20Pfizer%2D,a%20history%20of%20allergies. 

See for yourself the 227,000+ USA cases of reported ill_nesses that showed up after vascinations. To see all ad_verse reactions (new ill,nesses after getting vasc),  change the search field ""Vacsine Types(Diseases)"" to ""Cov id-19"". 

http://www.medalerts.org/vaersdb/findfield.php

http://www.medalerts.org/vaersdb/index.php

Check out the UK's cov_vaxc database for ad,verse effects. It's their version of VA_ERS in the USA. 

https://yellowcard.ukcolumn.org/yellow-card-reports

This list of censsored doctors. They're not anti-vax, just against the cov id vasx mass trials. They have to go to right-wing, unpopular media just to be heard. They're desperate. Lots of political cognitive dissonance on all sides,  and its jeopardized critical health advice. 

Dr. Charles H_offe being censured. 
https://vaccinechoicecanada.com/in-the-news/open-letter-to-dr-bonnie-henry-from-bc-physician-re-moderna-vaccine-reactions/?fbclid=IwAR3cxP-MaRW5xHS6mi7fU-nG33Jwb1oVU41U-P__rl2A2BIDi48xImb_PJs

OB GYN, Dr. Christine North_rup whose been on Oprah 10 times giving health advice.  
https://vaccinefromhell.com/shocking-testimonies-of-viral-shedding/

This is Adult Care Nurse, Tamika M. M_orrow in Bloomfield, Michigan. She tries to post her patient's side effects from the vasvine regarding blood cl_ot, auto-imm_une disease, heart attacks,  death, etc, but FB & YT algo_rythmn keeps taking it down. 

https://odysee.com/@Frank_Stoic_Castle:f/Michigan_RNP_Tamika_Morrow_Sharing_Info_About_mRNA_Jab:c

2008 Noble Prize doctor for sequencing HIV/AIDs. Dr. Luc Mon_tagnier. 

https://lbry.tv/@debunkingcops:1/luc-montagnier-hiv-nobel-prize-winner:d

His impeccable credentials. He's putting his Noble Prize and life work on the line coming out against the mass vascination pro_poganda.  

https://en.m.wikipedia.org/wiki/Luc_Montagnier

Here's Dr. Ch_etty of South Africa who treated over 4,000 cov_id patients (no deaths) with safe, cheap drugs/methods and he says you don't need the  vaxc, because this is easily treatable. There's docs worldwide are being cessored for giving alternatives to the vasx. 

https://youtu.be/wTHyp5uAzCc 

Facebook deleting people's post/comments about cov vasx ad_vers reactions.

https://odysee.com/@daveswildcamping:0/Facebook-Whistleblowers-LEAK-DOC

Note: to get your stores pass censsirs, use spaces, doors, underscores, etc on ""sensitive"" keyw",2021-05-26T19:23:46Z
977,What Vaccine is this?  The one causing the heart problems,2021-05-26T17:24:25Z
978,I just realize this morning I am a Transvax . I just totally self identify as vaccinated. I have natural immunity. It's part of who I am. Don't be afraid of me I don't bite I am just a regular person and I happen to be a Transvax!!!👍💪,2021-05-26T12:44:46Z
979,GENE THERAPY IS NOT A VACCINATION,2021-05-26T10:50:13Z
980,Covid is GONE in USA. Children should not be vaccinated. Why? What for? The RISK for exceeds the benefits. EMERGENCY USE ONLY AUTHORIZATION There is no longer an emergency. I know the Democrats need a continued emergency to remain in power since they can't govern otherwise. But this is no time to be experimenting with children. WAIT WAIT there is no Emergency.,2021-05-26T06:17:55Z
981,Kids don't even need it,2021-05-26T02:54:47Z
982,The human testing of this vaccine continues. This reminds me of Thalidomide scandal.,2021-05-25T22:36:28Z
983,They brushed past that topic quciker than the speed of light ...,2021-05-25T17:31:19Z
984,"Vaxxers be like,"" hurmmm I'm going to gargle human feces today and drink urine straight from the nozzle.""",2021-05-25T16:50:18Z
985,"I just wanna know from this comment section, who really believes this non sense media like i can’t imagine a person calmly watching this news sitting on his chair and believing everything they said... you would of have to be way too stupid to be that type pf person honestly",2021-05-25T16:35:10Z
986,"I’m 20 and healthy and got my vaccine in February/March. This is exactly what happened to me, very scary stuff. Ended up going to the emergency room because I was worried I was having a heart attack.",2021-05-25T16:12:57Z
987,"Pretty sure a certain someone did say the solution shouldn’t be worse than the problem.  Then again, these people were probably bullying others for vaccine hesitancy so their indoctrination earned them some karma.",2021-05-25T16:01:19Z
988,That vaccine is poison.  It almost killed me.,2021-05-25T15:52:28Z
989,China sure did a great job.,2021-05-25T14:36:12Z
990,"a small number of people die from covid......nvmd, theyre 82 years old, in a nursing home, and, already on the verge of death.",2021-05-25T12:38:00Z
991,"these people are such jackasses!!! don’t get the vaccine: you might die if you’re not taking appropriate precautions- Get the vaccine and either blood clots or heart problems will definitely smite you.
this wouldn’t be happening if we effectively studied these vaccines. We keep saying “only a few cases have complications”- but that point is mute because your entire pool hasn’t even been saturated. We have incomplete statistics that are putting people at risk and these assholes don’t care because “so many people have already died- whats a couple more” 
ps. did you see that story that exposed that people with arthritis for example “immune compromised” people didn’t grow antibodies from the vaccine- needing to get a third shot? 
that’s right- just cause you get the shot doesn’t mean it works and we don’t have anyone insuring effectiveness after the fact- 
Also that church that was watering down their covid shots? did you hear about that one? I have never seen regulation go so far down the drain.
We are literally in the wild west but minus all the perks.",2021-05-25T12:00:48Z
992,Oh yeah I'm sure your worried for us all psh...,2021-05-25T10:48:09Z
993,"So far, 18 children in Connecticut alone have been hospitalized for heart inflammation. Is this a ""small number"", for a condition that is ordinarily very rare?  How many reports throughout the country at this point have there been...hundreds? Even if these cases are considered ""mild"", what are the long-term effects of having had inflammation of the heart at an early age? Is this an acceptable risk for a virus that so few children have serious problems with?  Apparently, I have many questions that this media outlet will likely not answer. Article about the cases in CT: https://www.wtnh.com/news/health/coronavirus/could-the-covid-vaccine-enlarge-hearts-in-children-more-than-a-dozen-hospitalized-in-ct-cdc-investigating/",2021-05-25T09:45:14Z
994,"This is a brilliant way for pharmaceutical corps. to create clients in the future! The side effects of the jab, cause serious health problems in the future! So they'll need more drugs.  What a money maker!",2021-05-25T06:40:56Z
995,"Simple question, why should, previously healthy young adults, teenagers take the risk? When even if they were to develop the disease, a side effect would not be heart issues or anything serious! But taking the jab has an ever increasing list of serious side effects, like death!",2021-05-25T06:38:05Z
996,Kids are not dying of Covid why do they need a vaccine....so sad that people are so afraid that they are putting their kids on the alter of experimentation,2021-05-25T05:30:16Z
997,"What do you expect for a non-FDA approved, experiMENTAL, Genetically altering, synthetic injection?",2021-05-25T05:03:20Z
998,And they still running round telling people to get this B.S DONT BE NO FOOL!!,2021-05-25T04:36:10Z
999,A small number is all they're willing to tell you about.,2021-05-25T01:59:32Z
1000,"https://www.facebook.com/jungyon.yi
What is 'Corona Virus 19'? 
It is GOD's punishment for the crime. 
'Coronavirus 19' will follow the DNA individually and kill people in more cruel pains. 'Coronavirus 19' according to their crimes, they slowly kill them in more cruel suffering. There is no cure for'Corona Virus 19'. There is only partial treatment. Therefore, no vaccines exist. Individual DNA make the mutations of Coronavirus 19 and new diseases and epidemics will continue to appear and will be contagious to people. Not only the body, but also life, work and everything are destroyed.

Murderers in the United States and South korea die by they crimes  in pain.  More than they crimes.  They doing crime committed against to JESUS and servant of JESUS  ""Prophet Yi"" and his families. 
Murderers in the United States and South korea die in divine punishment according to the crimes committed against to JESUS and servant of JESUS  ""Prophet Yi"" and his families. 

Not only South Korea and the United States, but also the criminals of all countries who have been committed to committing crimes even though they know the truth are also destroyed in cruel pains and abused to die. 

Not even compared to their crimes.
24 hours a day without rest or equality.

Make public and punish criminals of murder and massacre in South korea and United States. Punish them (Mang Won) so that they are incomparable to the crimes that have been committed against to ""JESUS"" and ""Prophet Yi"" and his families for over 27 years. by Prophet Yi Jung-Yon ( David of JESUS )  Aug 25, 2020 


https://news.v.daum.net/v/20200823133710233 
Two public officials were infected with 'coronavirus 19' in the building of the South korea Ministry of Foreign Affairs. In the  den of criminal and Murder and abuse offenders South korea. 2020.08.23 news 

https://news.v.daum.net/v/20200819082919826 
Chinese heavy rain Continue ... Sichuan Province 'a huge flood once in a hundred years'. 2020.08.19. news 

https://news.v.daum.net/v/20200823143112099 
Hydrogen chloride, which becomes hydrochloric acid when dissolved in water, leaked from a chemical plant in China's Sichuan Province, causing great confusion as residents escaped. 2020.08.23. news 

https://news.v.daum.net/v/20200823143112099 
'Yang Zetsu', a member of the Chinese Communist Party's diplomatic politics bureau, visits 'Singapore' and South korea one after another. 2020.08.19 news 

https://news.v.daum.net/v/20200822122101173 
A nurse at 'Seoul Asan Hospital' became infected with the novel corona virus 19. A confirmed corona virus 19 infection was also found at the 'Bundang Cha Hospital' Cancer Center. Hospital treatment was completely stopped and part of the ward was closed. in the  den of criminal and Murder and abuse offenders South korea. 2020.08.22 news  

https://news.v.daum.net/v/20200822194614786 
Lightning strikes at Bukhan mountain, Mangyeongdae, killing 1 climber and seriously injured 1 by lightning. In the  den of criminal and Murder and abuse offenders South korea.  2020.08.22. news  

https://news.v.daum.net/v/20200822183711147 
Sewer backflow by intensive heavy rain. And hail. In the  den of criminal and Murder and abuse offenders South korea. 
2020.08.22. news 

https://news.v.daum.net/v/20200822195336850 
Twenty people were infected with 'corona virus 19' at the Antichrist's 'Galilee Church' in Bupyeong, Incheon, South korea. In the den of criminal and Murder and abuse offenders South korea. 2020.08.22. news 

https://news.v.daum.net/v/20200822205355431 
5 residents, including 'Incheon' public officials were 'coronavirus 19' infected confirmed in Gimpo. (the den of criminal and Murder and abuse offenders South korea.) 2020.08.22. news 

https://entertain.v.daum.net/v/20200820040314024 
'Corona virus 19' hit the CBS·KBS·SBS etc TV and radio broadcaster.  Also, hit the EBS educational broadcasting station, entertainers, producers and production crew. 'Stop shooting all programs'. In the den of criminal and Murder and abuse offenders South korea. 2020.08.20 news 

https://news.v.daum.net/v/20200822200828989 
Thunder, lightning, heavy rain hit the den of criminal and Murder and abuse offenders South korea. And new typhoons coming to South korea. 2020.08.22 news  

============================ 

The result is natural. 
The leader in your country did not obey the orders of JESUS' servant Prophet Yi (David of JESUS) and ignored it. 
From https://www.facebook.com/jungyon.yi  and https://twitter.com/Prophetyi    Continue 

https://news.v.daum.net/v/20200822200216922 
'A lot of hair falls out'.  Nearly 100 reports of abnormal symptoms. 2020.08.22. news / The sequelae of 'Coronavirus 19'. 'Coronavirus 19' that is not cured. / Corona virus 19 will not go away until these things are released. Murderers of South korean and American must be disclosed. Also, must be brutally and openly punish all crimes of them. Naturally all families of them, too. by Prophet Yi / 
From https://facebook.com/jungyon.yi 

command of GOD by prophet Yi Jung-Yon ( David of JESUS ) JESUS identifies to the they crime (Evil and cruel criminals Ugly South Koreans and U.S.Americans, 'Mang Won"") Cause of the disaster, because crime of murderer (South korean and American) / Corona virus 19 

Get China out of the WTO ! 
All countries do not have to pay the money they receive from China. If China want money from nations, China must be will have to pay for me first. About the fee of WTO and Olympic hosting. In the meantime, gain   interest",2021-05-25T01:39:30Z
1001,Its perfectly safe while there are massive debilitating  side effects and long term effects unknown (publicly) i will say ; ),2021-05-25T01:18:34Z
1002,"*THE VACCINES ARE SAFE!* You should definitely trust the vaccine manufacturers. I mean, they wouldn't lie over and over and over again, would they?:
 ""Pfizer has been a habitual offender, persistently engaging in illegal and corrupt marketing practices, bribing physicians and suppressing adverse trial results."" - PubMed",2021-05-25T01:14:39Z
