,comments,dateStamp
0,"Interesting we haven’t heard of any of these effects on this age group for well over a year. Just now that this vaccine was administered to them? Ok we will go with that. Nothing at all is linked to the vaccine same narrative and people wonder why there’s hesitancy? I’ll tell you, because this news report is misinformation and a ton of BS",2021-05-30T06:48:31Z
1,Then why does it happen right after the vaccine???????,2021-05-28T16:28:04Z
2,Ignorant Dr!! Myocarditis has never been a problem in healthy young people or children without biological heart defects prior to this vaccine! And she talks as though it has been a problem like cancer in the general population. These doctors are why I do not promote green cards or visas for doctors that are paid for by big pharma to tell people such nonsense!,2021-05-29T16:14:12Z
3,All I know is up yours Government and your experimental 💉 gene therapy,2021-05-26T22:24:42Z
4,Like i would believe anything this or any doctor tells me. Doctors aren't what they used to be. Honest and caring.  Now its all about the money.  Dont get the vaccine because you will die from it.,2021-05-26T20:48:37Z
5,And I've had this u dont ususky get chest pain its usually left shoulder pain and it hurts very bad.stabbing sharp pains.,2021-05-26T16:01:51Z
6,The CDC ain't investigating shit give me a break.,2021-05-26T16:00:16Z
7,"""its safe"" 🤡",2021-05-26T15:52:59Z
8,I AGREE WITH YOU 100%,2021-05-27T16:22:39Z
9,noone has any idea whether getting the vaccine is better or worse than getting covid for that individual all they can tell you is statistical chance and even statistics they cant accurately tell anyone at this point because future effects of taking one of these experimental vaccines could end up being a lot worse than recovering from covid they have no idea simply because future effects are completely unknown,2021-05-27T02:16:30Z
10,shes hot,2021-05-27T01:29:11Z
11,Look at India,2021-05-26T21:39:56Z
12,"I love the way you talk about this ""shit show"" out there! You sound like a smart young woman and you are saying exactly what I think with such ingenuity.",2021-05-26T14:07:15Z
13,I was WAITING on some information like this to get out!,2021-05-26T06:34:39Z
14,"the report of 18 teens recently vaccinated  in Conneticut who were  hospitalized is worthy of consideration. We can certainly assume there are other adverse events going unreported. Sadly many of the 300 teens who passed many had co morbidities, The injuries from treatment get the strong ones too.",2021-05-26T19:09:00Z
15,"Then don't vaccinated then. 12 thu 15 years old.  Or 12 and 14  .instead of 
Panicking don't do anything like going to bar or big social get together.
Small outdoor events are fine.

It is easy to not go of all your friends are also staying home. Do more zoom get together and outside things. 
 we still can't communicate online. There are online classes and online programs,  online fitss trainers.",2021-05-28T15:34:20Z
16,"Permanent heart cell damage in young people is rare, temporary and mild.",2021-05-26T16:30:22Z
17,"People,,they are TEENAGERS",2021-05-26T10:59:18Z
18,"""rare"" because they won't tell you the true numbers.",2021-05-26T01:43:31Z
19,The Lockdown is permanent!,2021-05-26T00:26:14Z
20,Sinovac is the safest of all.,2021-05-26T00:25:56Z
21,"I am concerned about these side effects: DVT, immune thrombocytopenia, cerebral venous thrombosis, myocarditis in healthy, young people after mRNA vaccines are leading me to believe vaccination is not always best. I know people who contracted the virus and later had horrible side effects from the vaccine: lingering bad headaches, cycle changes, etc.; other's had mild reactions. There's no way my teen will be getting vaccinated until there is far more information. it's a hard pass on the vaccine! Considering do no harm is the motto, I think it's harmful for the so-called experts like Fauci to suggest teens and kids get this vaccine.",2021-05-25T21:36:58Z
22,Good thing i waited i have not vaccinated my kids and i have not got mines either .  I can wait untill is safe to do so just keep wearing my mask and wash my hands allot . Its been working i have not gotten the virus and not even my kids or husband.,2021-05-25T21:33:17Z
23,I’m sure ABC 7 is convinced that they are doing the public a great service  by reporting the .0001% complications from a vaccine. Way to go guys.,2021-05-25T21:30:37Z
24,"As time goes by, all these VAX-BOTS will be proven to be the dangerous lemmings they are.  Total dopes!!  Give me the vaccine!!! Yay!!  I’m somebody for once, because I have the vaccine!!!   You all sound like those “bug catchers” with HIV.  All happy to be on the road to lifelong adverse reactions.  Congratulations !!",2021-05-25T21:20:17Z
25,"British model Stephanie Dubois died from a blood clot days after receiving AstraZeneca’s Covid-19 vaccine.

According to Greek media, Dubois, 39, suffered a “serious thrombotic episode” on May 14 and needed to hospitalized after receiving her first Covid dose on May 6.",2021-05-25T21:18:06Z
26,That Vaccination Was Created 2 Fast . I'll Just Keep Getting Tested .,2021-05-25T20:43:51Z
27,More than 3 million people are having physical side effects from covid vaccines. Stop pushing this poison. And the number of deaths is in the thousands.,2021-05-25T20:34:32Z
28,Dr. John Campbell please explain this to everyone!  https://www.youtube.com/watch?v=pyPjAfNNA-U,2021-05-30T15:54:46Z
29,"Abdominal pain can be a heart attack, often a symptom in women.
https://www.mayoclinic.org/diseases-conditions/heart-attack/in-depth/heart-attack-symptoms/art-20047744
https://www.heart.org/en/health-topics/heart-attack/warning-signs-of-a-heart-attack/heart-attack-symptoms-in-women",2021-05-30T15:48:02Z
30,"Unbelievable. I had the symptoms you describe  after vaccination. I thought that was strange but thought nothing of it until I just watched your video. And ..no joke but I bought a new pair of running trainers .after the vaccine. but haven't used them yet , thankfully ! Thank you for great information.",2021-05-30T14:12:18Z
31,"Do you think the measures you recommended when first Covid appeared and the CDC guidelines and the mask protocol will work to prevent Covid in India ? 
https://med300.com/question/can-you-prevent-covid/",2021-05-30T13:49:43Z
32,https://youtu.be/zFS57OJ9VyM,2021-05-30T13:45:08Z
33,Doctors say carditis rate are 1/2500 in Israeli young adults.,2021-05-30T12:46:46Z
34,"However rare, is this a risk that healthy people should take? Mass vaccination of a population with an inadequately tested experimental gene therapy is sinister.",2021-05-30T08:31:02Z
35,We are soo very lucky to have you. I wanted to mention i had tachycardia and noticed when my BF wanted to start using decaf coffee my tachycardia  went away!! It would not hurt to go decaf for a little while and see if that also helps them??,2021-05-30T08:22:50Z
36,"Some explanation seems to be offered here

https://www.youtube.com/watch?v=Sis1Sddzbqk",2021-05-30T08:21:04Z
37,Well about 9% of people who get the Flu get myocarditis. About .00001% get myocarditis from this vaccine ( I may be missing 2 or 3 zeros there) 1/3 or 33% of C19 infections result in neurological damage ( the survivors even those with mild cases). I just think from a purely numbers standpoint it makes more sense to get vaccinated but be aware of potential side effects.  Surviving a C19 doesn't mean you returned to baseline. It just means you didn't die. Even the healthy.,2021-05-30T06:55:51Z
38,Children have practically zero chance of death due to covid & shouldn't get a emergency-vaccine. Frontline docs are suing to stop vaccines for children,2021-05-30T06:28:47Z
39,I so believe in you. But....... I only love you because I did my homework !! Man.....   God bless America!’,2021-05-30T06:12:57Z
40,A virus has to run its course unless its altered . A bacterial infection needs first aid. Sometimes immediately. Those who can catch it !!,2021-05-30T06:08:27Z
41,From what I have learned from the virus it is a respiratory system problem with blood vessels so when you recover from it you will have some health problems but if you lived through it there is medicine to take to help you out follow the science for real this is not over yet,2021-05-30T05:03:34Z
42,Thank you for your help and guidance always ❤️,2021-05-30T04:57:05Z
43,We have to take care of our selves definitely after the shot is given,2021-05-30T04:56:05Z
44,It's a evil ughly virus and it doesn't matter who it attacks,2021-05-30T04:52:30Z
45,"My sister got the virus 😷 in a rehab nursing home facility after having foot surgery and they were using this place to help people and it was close to the hospital but the hospital was fully packed with the people who had the virus and 23 people had the virus from a worker that came in with the virus
So I just wanted to make sure people understand help each other out and get vaccine shot done and save your self and some other people to amen God bless you all always 🙏🙌",2021-05-30T04:51:22Z
46,Sore arm and small head ache and wanted to sleep some but I am alive and I still wearing a mask when I get a in public just to be safe life is a chance get a shot,2021-05-30T04:43:10Z
47,Just die the natural way forget getting the vaccine it's a time bomb on your heart I have one more to go before I die it hurts alot not fun at all,2021-05-30T03:52:34Z
48,Moderna 🙋🏻‍♀️🙋🏻‍♀️ 41 yr old Hispanic woman. First shot not issues. Second shot a 24 hrs of mild fever and fatigued. No issues 2 months later. Even had a mammograms and nothing showed up...,2021-05-30T01:39:05Z
49,OMG....do not exercise is great advise and I wasn’t told.,2021-05-30T01:36:36Z
50,I’m pro vaccination but waiting another year to decide on the SARS2 vaccine. Do we have the vaccine for SARS1 yet?,2021-05-30T01:27:18Z
51,Don’t ask reasonable Scientific questions about vaccines John. You know that’s not allowed.,2021-05-30T01:15:45Z
52,"I really respect your work and expertise.  I would like you to explain to me why we would be vaccinating young children and young adults, who have little to no risk of dying from COVID? And also I would like you to address the fact that many people who have gotten these vaccines have also contracted Covid after receiving the vaccine. Why is this happening and why aren’t we paying attention to that?",2021-05-30T00:12:38Z
53,I take homocysteine reducing supplements. Most people have some soft of cardiac inflammation because of their diet.,2021-05-29T23:37:59Z
54,"This nonsense of getting the experimental drug injection has to stop
 People are being used as lab rats. These so called experts are out to destroy humanity. Our governments 
don’t care what happens to us. They sold out on us. These jabs are harming and possibly killing 
People. My goodness when is someone going to stop these evil beings, maybe they aren’t humans, but
demonic beings who hate humans!  Why can’t Dr. tam, and the other guy be honest with Canadians.
Too much money invested on ruining Canadian lives.  Enough with your lies, you should be
Fired, and face tribunals.",2021-05-29T22:55:22Z
55,any compensation from the companies to the people who developed all these side effects?,2021-05-29T22:16:41Z
56,Holy hell I'm losing IQ reading this comment section.,2021-05-29T21:38:07Z
57,"Perhaps it might be wiser to primarily vaccinate older people (or at least people over 35), since they're more at risk of complications from COVID, and seem to be less at risk of _at least some_ of the severe side effects of the vaccine.",2021-05-29T21:08:51Z
58,"I  am a nurse immuniser ..
never ever heard of so many side effects from any known vaccine ever  The reactions are overwhelming with this Corona Virus vaccine 
Been giving babies children their jabs for years 
No side effects hardly all    Imagine mandating to give this experiment to children  which is what they are advocating in the US",2021-05-29T20:41:25Z
59,"If your MP has written to Hancock then he, you and your followers may have a long, long wait!",2021-05-29T19:47:44Z
60,Risk all that for a vaccine against something which won’t kill you. ?,2021-05-29T19:03:22Z
61,Funny to see Americans worried about their hearts now.🤣🤣🤣 The most obese country in the world where folks basically live on hot dogs and McDonald’s they are now worried about a very rare condition a vaccine might pose. Hilarious!! 🤣🤣,2021-05-29T18:53:48Z
62,get gerrard van den bosche on show for post vaccine risks,2021-05-29T18:29:48Z
63,Excellent content Dr.Campbell.,2021-05-29T16:41:36Z
64,How about no vaccines. Worst case scenario 95% survival rate from this scam demek so what do we need to inject poison for? Oh yeah I know big Pharma needs a shot in the arm,2021-05-29T16:29:12Z
65,"I know 10 people that got moderna vaccine, 3 of them got irregular heart beats, all now on medication for it, shove it up where sun doesn't shine.",2021-05-29T16:27:07Z
66,Heard a young woman talk yesterday about how she's feeling after her vaccination. She's got intermittent chest pains and feels exhausted. Her symptoms seem similar to be this. She's been fobbed off by most health care  workers. She'd not done a Yellow Card but has now. Finally she's got a doc appointment for blood tests next week. No one cares what happens to people injured. Saw  another post where a nurse in A&E hospital said they knew what vaccine people had before they were told. A French ambulance man asked in large Lyon Hospital about all the patients he was bringing in with strokes after getting jabbed. He was told there were hundreds of them but none were being reported to management. Must be an order to hide the severe adverse events.,2021-05-29T15:11:06Z
67,Thank you for all the information you share with us.,2021-05-29T15:07:42Z
68,"And Pfizer data on the VAERS has been removed... hmmmm. “ trust our science, trust our experts” 😂🤣. Down-play vaccine side effects and fear monger the virus? Great science, way to go planet earth. Meanwhile we are evolving from primates 🙈🙉🙊",2021-05-29T14:25:03Z
69,"Is the vaers website international or just for US reporting? I read that since the vaers is voluntary reporting, only about 1% of the adverse effects are reported ..is that the case with the data of 62 cases out of millions?",2021-05-29T13:49:42Z
70,"Isn't mRNA vaccine equivalent to 'genetic engineering'? There is no long-term experiential evidences or scientific evidences, data on this type of vaccine. When thinking about 'lab-leaked' of the virus and how humans try playing God, by mastering the unfathomable complexity of nature. it is scary to allow our bodies for such a grand global experiment.",2021-05-29T12:38:05Z
71,16:04 There's a black hole for suggestions and correspondence. A black hole of intellect.🤣,2021-05-29T11:20:01Z
72,"4:52 A Potential heart rhythm called ventricular fibrillation, VF That's ""cardiac arrest"" folks by another name. No pulse. If not defibrillated, death comes very soon. I don't understand why doc uses the word mildvin the next sentence.  Anything that can cause VF is not mild. Oh by the way, that drug that shall not be named (hydroxykhlorokwin) had the very rare side effect of infucing a kind of ventricular tachycardia that might lead to cardiac arrest. Actually though, the drug caused QT prolongation on the ECG, which might lead to increased chance of this rhythm but in the end, without an overdose there were very few deaths anywhere, ever caused by this drug according to WHO studies. Now the shoe is on the other foot and it's the vaccine, the risks are being downplayed as usual.",2021-05-29T11:02:37Z
73,"Man gets hit by a bus after testing positive to Covid 19... Maybe he just wasn't looking and stepped onto the road?  Maybe he had a medical episode?  Maybe Covid 19 killed him?  Yep! Pretty sure it was the Covid 19, whack that down on his death certificate.  Man drops dead of heart failure 24 hours after covid 19 vaccine.  Maybe he had an undiagnosed condition?  Maybe he over did it?  Maybe it was the covid vaccine?  Yep!  Pretty sure he had an undiagnosed condition, whack that down on the death certificate.",2021-05-29T10:48:03Z
74,"Hello John, I would like to share with you that I had long covid last year (March-September 2020). I got my first shot of Pfizer one month ago and had a really strong reaction (fever, body pain, extreme fatigue, etc.. Three weeks later I had a relapse exactly like the ones I had during long covid (brain fog, weakness, chills, SOB, and muscle pain). I got tested just to make sure I have not been re-infected and the result was negative. Here in Germany the ongoing recommendation is to get only one shot of the vaccine if you already had Covid before but my doctor said it was ok to get the second, however she told me too to get an antibody test so we could decide. My antibody levels were over 384, they could not even messure the exact number as it was above the limit. At the end my GP decided the best for me (special case) was to get the second shot in a couple of months. I can imagine that people getting Myocarditis might be having as me, an hyper reactive inmune response. I dont know if this information is important or not but I wanted to share it with you. 
Thanx for all your work!!",2021-05-29T10:38:22Z
75,Thanks to your having an enquiring mind on our behalf! I’m fully vaccinated by the way with the Moderna vaccine.,2021-05-29T08:27:00Z
76,"I'm an echocardiographer at one of the largest NHS hospitals. I scan nearly 100 patients a week, most of whom have had the vaccine, I haven't come across any post vaccine myocarditis. This complication is rare.",2021-05-29T07:53:07Z
77,You run marathons!! You put me to shame!! I’m no where near any marathon runs!,2021-05-29T07:50:54Z
78,"I'm not bloody well taking that thing, thank you very much.  They can f**k right off.",2021-05-29T07:26:52Z
79,I took the Pfizer vaccine. I'm an 18 year old male. And I got myocarditis two days after my second dose. I took a Zyrtec and it went away,2021-05-29T06:43:03Z
80,"I really to hear now positive you are about these vaccines, but you don’t seem to learn about the dangers from them and the no-need for these experimental vaccines.  Look at what you are doing now ! People are already vaccinated,and after, you start to discuss the casualties !! So these are indeed experimental tests on people, is my opinion.",2021-05-29T06:26:38Z
81,"This MEDICAL EXPERIMENT ON PEOPLE HAS TO STOP!!!!!! DON'T TAKE IT!!!!  IT'S A HORRIBLE TECHNOLOGY THAT WE DONT NEED!! I PRAY THAT GOD WILL FORGIVE ALL THOSE WHO PROMOTE AND PUSH IT ON PEOPLE. CLEARLY FROM THIS VIDEO THEY ARE DOING ""STUDY"" ON THIS POISON WHILE GIVING IT TO MILIONS OF PEOPLE. EVEN DOCTORS DON'T WANT TO TAKE IT. UNEXACTIBLE!!!!!!!!!!!",2021-05-29T06:06:15Z
82,"Ok MY PROBLEM ..DO WE HAVE PEOPLE WHO CAN SPEAK ENGLISH , WHO WE CAN ACTUALLY UNDERSTAND IN THE INVESTIGATION OF THIS DRUG !..??? I HAVE JUST COME TO THE END OF MY PATIENCE WITH IT !! MORE THEN TWO THIRDS OF THE TIME I CANNOT UNDERSTAND WHAT IS BEING SAID WHY DONT PROPER ENGLISH SPEAKING PEOPLE DO RESEARCH ???",2021-05-29T06:01:53Z
83,"You are incredulous. These jabs are NOT vaccines in any shape or fashion. They are a DNA injection,. They do not prevent infection or give immunity.,**BETTER TO GET THE actual INFECTION AND BE IMMUNE FOE LIFE. 
You are so deluded and jaded by your big pharma worship. In other words, your videos are a huge waste of time.",2021-05-29T05:31:09Z
84,I’ve had myocarditis after a bad bout of strep throat and it’s no walk in the park  I was on strict bed for almost a month  ..and it was a while before I felt anywhere normal ...,2021-05-29T04:58:16Z
85,I certainly won't be taking this shit.,2021-05-29T04:17:54Z
86,I'll hold out for all you lab rats.,2021-05-29T04:03:24Z
87,"Still not getting the jab , I chose to loose 70 lbs instead ... only side affect is I am close shopping a lot 😁 .",2021-05-29T03:55:25Z
88,"I had CHF in 2008 caused by Pertussis getting into heart together with a mycoplasma secondary infection. Since then I had intermittent AF and often needing a cardioversion in hospital to get back to sinus rhythm. 3 cardiac ablation operations later and a fairly rigid exercise routine, which has strengthened my heart muscle I very seldom get AF. The last time was after a heavy cold which got into my chest and then heart and I required a cardioversion. I take 100mg of Flecainide and 30mg of Diltiazem morning and night to prevent it. About 2 weeks after my first AZ vaccine I got AF, or it may have been Atrial Flutter. It was very puzzling as none of the usual triggers (they are principally electromagnetic) were present. So I took my evening medication at 1.00 PM and lay down but that didn't restore sinus rhythm so at about 4.00 PM I took an extra 90 mg of Diltiazem. My heart returned to sinus rhythm about half an hour later. Good job I was sitting down because there was a sudden significant drop in blood pressure before the heart started beating normally. I haven't had any further issues but I was concerned as to why the AF happened at that time. You have now provided the reason and I shall be on the look out for a similar occurrence after I have had my second jab.",2021-05-29T02:44:11Z
89,"Well, 1/100.000 death by side effects surpasses death rate by COVID for young adults under 30. Therefore, people under 30, with no comorbidities, should not get any jab. Simple.",2021-05-29T02:39:46Z
90,"Unfortunately, it seems the US is generalizing figures that don’t support immunizations.  I don’t feel proper instructions were or are being given to vaccine recipients on how to report adverse reactions.  A lack of data certainly supports their objective.  Is there any information for those of us living with autoimmune? I am truly terrified the vaccine could trigger an immune response that might be difficult to calm. Thank you!! ☮️",2021-05-29T02:36:36Z
91,it's NOT rare when it happens to YOU!,2021-05-29T02:20:20Z
92,"My father who is 83 is now in the hospital after having a few minor strokes at home and a major stroke while at the hospital. His heart rate in the ER got as low as 43 and never higher than 57, he had no previous condition's that would have contributed to this until after he received his second Moderna shot. There is no doubt in my mind this vaccine is the cause and my family is now nervously waiting by the phone as he is in the ICU and has not improved in day's.",2021-05-29T01:58:02Z
93,I don’t think there has been any time in the history of the human race that uncertainty and fears are actually worse than dying from a virus.,2021-05-29T00:10:26Z
94,Most of the time people don't have any consequences from myocaridtis.. or covid.. the difference is 100.000.000.000 $ market.,2021-05-28T23:38:31Z
95,A month ago you commented on reports of myocarditis in Israel.  Now America - and you think it's correlation not causation?  Take a look at the rest of the world... You think those people have an energy drink habit?  Or - does the fact it usually happens 4 days after the shot tell you something?,2021-05-28T23:25:56Z
96,"My very healthy 23 year old nephew suffered a heart attack and got diagnosed with pericarditis 4 days after he vaccinated with moderna. 
He is a soldier/medical assistant at the army and since he had undergo frequent health checks he was- quote ""healthy and strong like an racehorse"" the army medical used to say.
For me personally this health issues has come with the vaccine- there's no doubt.",2021-05-28T23:20:58Z
97,After my first shot of AZ at hospital I was shown the door within 5 mins. No waiting and no advice not to exercise. Worrying given I was walking 1 mile home.  Now weary of getting 2nd shot even though I'm 59.  Questions need to be asked why there are so many reactions to these vaccines.  The level of risk might be low but why is there a risk at all?,2021-05-28T22:30:46Z
98,How about take the vaccine if you want and don't take the vaccine if you don't want to? The flu has been around forever its still here. Covid will be here LONG after we are gone.,2021-05-28T22:28:54Z
99,Needs to get a bit more radical I’m afraid,2021-05-28T22:28:53Z
