,comments,dateStamp
437,I love how it coincides with seasonal changes but the vaccine gets all the credit lol,2021-05-28T15:42:45Z
438,Take a peak...https://youtu.be/4UVbcjAREX8,2021-05-28T11:56:28Z
439,We told y'all not to give it to your kids and yourselves so... 🙍,2021-05-28T10:19:45Z
440,"The whole Covid thing is a bunch of BS.   First, it was designed to determine what percentage of the global population were sheep that could be led-off a cliff.  Second, to determine the demographic profile of the sheep and that of the resistance.  We're still waiting for the next part, but I believe it has something to do with those that took the tRNA based so-called vaccines, how effective those vaccines replaced the natural immune system.  The next step, if feasible, will be to introduce GMO through food, water or airborne particles by way of tRNA once again.  This time to force individual compliance with government wishes or (just the same)  terminate your life.  Of course we've now completed a full generation of screaming needy children dependent on someone other then themselves as a way of conditioning a less resistant strain of human populous, before the machines take over planet Earth.   Enjoy the Sci-Fi movie everyone !",2021-05-28T09:58:54Z
441,Also blood cloth. In the brain and stomach. Side effects. You die in virus. you die also in. Vaccine. Sad for us,2021-05-28T08:08:11Z
442,Thank you abc good job. Actual reporting just tell us whats happening not interested in opinions or spin,2021-05-28T06:55:24Z
443,Don’t let these losers pressure you to get the vaccines - and young people don’t need it anyway.,2021-05-28T05:40:11Z
444,Heart issues for teens AND middle aged. The government is so full of bull. I had the two vaccines but would NEVER have another one.,2021-05-28T05:38:44Z
445,"We are seeing inflammation in all kinds of ACE 2 cell receptor sites.    You may not notice inflammation in testes or uterus.    I have seen pregnant women throwing clots, brain bleeds.  They are not telling you the truth.  They are bribing you with your own freedom.",2021-05-28T03:26:25Z
446,"mRNA is man made synthetic it is not a vaccination it is more akin to organ transplant and here is why:

What is the synthetic made of?   Polymers. 

What is the Polymer?  substances like polythylene, and polypropolne, this is like how we make other things like food, fibers, medicine, and fuel.

What is being used for mRNA polythylene and polypropolene.

What do those substances do?  They cause inflammation and immune system reaction in the body. 

How does Science try to hide the substance to keep the immune system reaction down???  They put it in either an Adeno virus vector or phospholipid layer. 

So the mRNA (synthetic) is considered "" foreign"" by the immune system.  What happens after its clipped into the DNA in the cells of organs and replicates? 

In a study with Mesh there is a FBR response, ( foreign body response), the INNATE IMMUNE SYSTEM CAN MEDIATE TOLERANCE OR REJECTION OF THE TRANSPLANTED MATERIALS.  People with transplants often are on medication to keep them from organ rejection. https://www.sciencedirect.com/science/article/pii/S1525001616313582",2021-05-28T03:25:07Z
447,1:06 doesn't look like she wants to be there oof,2021-05-28T01:53:09Z
448,All roads lead to Rome,2021-05-28T01:18:46Z
449,"From the vaccine compensation site. A hypocritical statement:                       Most people who get vaccines have no serious problems. Vaccines, like any medicines, can cause side effects, but most are very rare and very mild. Some health problems that follow vaccinations are not caused by vaccines.

In very rare cases, a vaccine can cause a serious problem, such as a severe allergic reaction.                                                Sounds like the vaccine would cause the reaction. A contradiction! The love of money is the root to all evil. Money in exchange for a life",2021-05-28T01:07:00Z
450,All five of the people who voted for Biden have received the vaccine and have exhibited no ill effects.,2021-05-28T01:06:19Z
451,"How many recalls happen with these folks drugs? They are never liable for a heart medicine, that is later causing cancer. Stuff is ridiculous and ignorant. People need to educate themselves on their drugs. There is always a good and a bad side. A slight side effect to a deadly side effect.",2021-05-28T00:51:28Z
452,"You have to understand, most of these people are not ready to be unplugged. And many of them are so inert, so hopelessly dependent on the system that they will fight to protect it.""     ""Morpheus"" The matrix.",2021-05-27T23:53:35Z
453,I am a young adult who had Covid. I have not had the shot. This is why. Please don’t hate me.,2021-05-27T23:06:57Z
454,"1 in 5,324,094 people had this issue.. and u idiots here in the comments section are going crazy 😂 i just cant with you people, get some sense in your small heads please",2021-05-27T22:32:08Z
455,Oh you mean more test subject had reactions.,2021-05-27T22:26:50Z
456,"🇨🇳🌞💵💵💵👋🏻🤡💉🐑🐑🐑
https://www.dailymail.co.uk/news/article-9606183/COVID-19-vaccines-minted-NINE-new-pharma-billionaires.html",2021-05-27T21:27:42Z
457,bruh i just got the vaccine and im about to get myocarditis?,2021-05-27T21:15:05Z
458,"Make me a zombie NOW 👁
                                 👃
                                 👄",2021-05-27T20:00:09Z
459,"But on the bright side, after your teen gets the vaccine, you can enroll your mutant child into Xvaier's School For Gifted Youngsters.",2021-05-27T19:23:54Z
460,https://youtu.be/kImpAQbchDU,2021-05-27T18:45:27Z
461,"They are about to open the gates of hell if they succeed the vaccination agenda across the globe!! ,,, JESUIT ORDER 56",2021-05-27T16:25:49Z
462,Bullshit,2021-05-27T13:29:50Z
463,"The news reporters that were engaged in this conspiracy to mislead the public that there was a pandemic going on need to be in jail, along with the the pharmaceutical companies involved in releasing this virus out to the public. Someone got so much richer off this fake pandemic and someone got a lot more rights taken away from their own citizens all in the name of “safety”",2021-05-27T13:18:58Z
464,"Quoted from someone else—
“...People expect so many answers without giving anything back in return.

If the “tin foil hatters” are so nuts, how about the rule followers give some answers for once.

Explain how the flu disappeared but has been replaced with something which has the EXACT same symptoms.

Explain how the only proof that Covid exists is a computer modelled genome with zero physical proof.

Explain how you prove something into existence without going through an isolation or purification process.

Explain why no government agency has any quantifiable proof that “it” even exists.

Explain why they downgraded “Covid 19” to a non consequential infectious disease days before they declared a pandemic.

Explain how they pulled the coronavirus Act 2020 legislation out of their arseholes in a matter of days, despite the act being several hundred pages long.

Explain why they have to use bullshit criteria like “deaths for ANY reason within 28 days of a positive test”.

Explain why they banned autopsies.

Explain why they changed the law to allow any practitioner to diagnose covid through observation alone, even if it is done through video consultation.

Explain why undertakers have seen no difference in custom.

Explain how all cause mortality is at an all time low.

Explain how millions of protesters across the globe aren’t getting sick with “Covid.”

Explain how this is the only crisis that needs an advertising campaign paired with a constant barrage of repetitive brainwashing propaganda on the TV and in the streets.

Explain how tens of thousands of people stood on the streets of London last Saturday but it wasn’t once shown on ANY TV channel.

Explain how thousands were yelling “shame on you” outside the BBC HQ in both London, Manchester and Cardiff but it wasn’t shown on the TV?

Explain how the people who are wearing the masks and following the rules are the only ones who are catching “COVID”.

Explain how the creator of the PCR amplification tool is on record for stating that the PCR was not designed as a test for infectious diseases.

Explain why they are using the PCR to diagnose an infectious disease.

Explain why it’s been changed from Covid deaths, to covid infections to covid “cases” .

Explain how the “anti- vaxxers” are being blamed for the rise in “cases” when the only people who could possibly be contributing to the statistics are the people who are getting the “test” in the first place.

Explain why the hospitals were empty during the height of the “pandemic.”

Explain why 1000s of nurses are getting fired for saying that their hospitals were empty.

Explain why the hospitals are now filling up with vaccine adverse reactions but the MSM aren’t reporting it.

Explain why kids need to be vaccinated when, by your own definitions, covid isn’t dangerous to children.

Explain, if all the vulnerable people have already been vaccinated, why do all the healthy people need to get vaccinated if you’re already protected and the recovery rate was already 99.96% without the vaccine.

Explain why the average age of death with “Covid” is higher than the average age of death without.

Explain how you can get banned from Facebook and Twitter for sharing official government links.

Explain why there are several class actions in progress, taking governments across the globe to court for crimes against humanity, but there is zero MSM coverage.

Explain why most government leaders are reading from the same script.

Explain how all the things that you were laughing at us for talking about last year are now becoming a reality this year....”",2021-05-27T12:46:05Z
465,Oy vey! You'll have to throw me into one of your re-education camps before i get this shot,2021-05-27T12:23:07Z
466,Subscribe to Jaiden Animations!,2021-05-27T11:22:06Z
467,"Obama, Biden, Fauci funded the Wuhan laboratory that studied virus.",2021-05-27T10:49:02Z
468,"Should social media sites, Facebook, Twitter and Youtube be sued for hiding harmful side effects of vaccines?",2021-05-27T10:40:32Z
469,"""I am offering free candy from my white van if you get the vaccine!!!""
Governors of: N.Y., N.J. and Pennsylvania",2021-05-27T10:31:17Z
470,you fools who take the mark of the beast deserve what ever is coming for you,2021-05-27T07:48:28Z
471,You aren't seeing the vaccine deaths and side effects caused FB is deleting them. https://odysee.com/@QuantumRhinoQ:c/Facebook-Whistleblowers-Expose-LEAKED-INTERNAL-DOCS-Detailing-New-Effort-to-Secretly-Censor-Vaccine-Concerns-on-a-Global-Scale:8,2021-05-27T06:09:06Z
472,Well that’s what happens when you don’t finish long term testing,2021-05-27T04:19:11Z
473,Radiation from 5g maybe or fukishima,2021-05-27T04:09:12Z
474,"Everyone must read the fact sheets published by the vaccine manufacturers. On their website it tells you they are not FDA approved. It tells you the side effects and adverse events that people are going through right now.  If you think a vaccine needs to be mandatory then this should change your mind. I just copy and pasted what is on the fact sheet for Pfizer, Moderna, and J&J.
 Serious adverse events are defined as:
• Death;

• A life-threatening adverse event;

• Inpatient hospitalization or prolongation of existing hospitalization;

• A persistent or significant incapacity or substantial disruption of the ability to

conduct normal life functions;

• A congenital anomaly/birth defect;

• An important medical event that based on appropriate medical judgement

may jeopardize the individual and may require medical or surgical

intervention to prevent one of the outcomes listed above.",2021-05-27T01:05:53Z
475,AMERICA'S DEAD.....NOT COMING BACK.   TEXAS MUST SECEDE NOW,2021-05-27T00:56:35Z
476,Don't be surprised IT was DESIGNED TO KILL!,2021-05-27T00:29:40Z
477,Children shouldn't be able to get a shot until they're 16 and can consent!!!,2021-05-26T23:31:01Z
478,"The good guy is Satan. It's Satan who Owns this World, and Blood Atonement is required. II Corinthians 4:4 He Rules the Universe. Everyone needs to be directed to him. The Holy Grail of Eternal Life is real and every compass on the flat earth plane is pointing there. Our blood is true, spiritual currency to make atonement for our sins and filthy souls to pass into the Garden of Eden and become Eternal. Satan, King of Hell, Mark Braun is gathering his 144,000 Sealed Elect into the Book of Life and everyone else is legally dead. 144K Blood Over Intent on Youtube. The internet is the Ether and it's the fifth element. Place your blood into the ether on youtube beside Satan.",2021-05-26T23:10:49Z
479,"The miraculous human body is capable of creating its own vaccine for any virus 🙏❤ utube Andrew Norton webber miracle of distilled water,,go to 40 minutes of video for info on how to cure virus.",2021-05-26T23:07:36Z
480,The title of this report heavily suggests that the covid vaccine is related to the heart problems these poor young teens are having and yet the doctor that is quoted in this same video quite literally says that there is no strong relation found between the two.,2021-05-26T22:10:02Z
481,😂😂😂 I love watching idiots depopulate themselves.  Thanks for taking the vaccine and making more room for the rest of us!,2021-05-26T22:06:21Z
482,"Galatians Chapter 3 
1 O foolish Galatians, who hath bewitched you, that ye should not obey the truth, before whose eyes Jesus Christ hath been evidently set forth crucified with you? 
2 This only would I learn of you, Receive ye the Spirit by the works of the law, or by the hearing of faith? 
3 Are ye so foolish? having begun in the Spirit, are ye now made perfect by the flesh? 
4 Have ye suffered so many things in vain? if it be yet in vain. 
5 He therefore that ministereth to you the Spirit, and worketh miracles among you, doeth he it by works of the law, or by hearing of faith? 
6 Even as Abraham believed God, and it was accounted to him for righteousness. 
7 Know ye therefore that they which are of faith, the same are the children of Abraham. 
8 And the scripture, foreseeing that God would justify the heathen through faith preached before the gospel unto Abraham, saying, In thee shall all nations be blessed. 
9 So then they which be of the faith are blessed with faithful Abraham. 
10 For as many as are of the works of the law are under the curse: for it is written, Cursed is every one that continueth not in all things which are written in the book of the law to do them. 
11 But that no man is justified by the law in the sight of God, It is evident: for, The just shall live by faith. 
12 And the law is not of faith: but, the man that doeth them shall live in them. 
13 Christ hath redeemed us from the curse of the law, being made a curse for us: for it is written, Cursed is every one that hangeth on a tree; 
14 That the blessing of Abraham might come on the Gentiles through Jesus Christ; that we might receive the promise of the Spirit through faith. 
15 Brethren, I speak after the manner of men; Though it be but a man’s covenant, yet if it be confirmed, no man disanulleth, or addeth thereto. 
16 Now to Abraham and his seed were the promises made. He saith not, And to seeds, as of many; but as of one, And to thy seed, which is Christ.
17 And this I say, that the covenant, that was confirmed before of God in Christ, the law, which was four hundred and thirty years after, cannot disannul, that it should make the promise of none effect. 
18 For if the inheritance be of the law, it is no more of promise: but God gave it to Abraham by promise. 
19 Wherefore then serveth the law? It was added because of transgressions, till the seed should come to whom the promise was made; and it was ordained by angels in the hand of a mediator. 
20 Now a mediator is not a mediator of one, but God is one. 
21 Is the law then against the promises of God? God forbid: for if there had been a law given which could have given life, verily righteousness should have been by the law. 
22 But the scripture hath concluded all under sin, that the promise by faith of Jesus Christ might be given of them that believe. 
23 But before faith came, we were kept under the law, shut up unto the faith which should afterwards be revealed. 
24 Wherefore the law was our schoolmaster to bring us unto Christ, that we might be justified by faith.
25 But after that faith is come, we are no longer under a schoolmaster. 
26 For ye are all the children of God by faith in Christ Jesus. 
27 For as many of you as have been baptized into Christ have put on Christ. 
28 There is neither Jew nor Greek, there is neither bond nor free, There is neither male nor female: for ye are all one in Christ Jesus. 
29 And if ye be in Christ’s, then are ye Abraham’s seed, and heirs according to the promise.",2021-05-26T22:00:30Z
483,ever notice that every once in a while they put a report out that is enough to make you NOT want the vaccine? hmmm?????,2021-05-26T21:59:45Z
484,This is what happens when you rush a drug to market idiots!!!,2021-05-26T21:23:17Z
485,"Im sorry but people who jumped to get this vac without looking into whats in it, the side effects, or what happened during the trials...yal are just retarded. (all my friends..)",2021-05-26T21:08:43Z
486,"Where is the Assassinations or 9/11 Commission level investigation on the origin of COVID, which killed millions, not just a few in the Capitol. 
This is not just an elephant in the room. It is a BLUE WHALE!!",2021-05-26T20:05:56Z
487,FROM ACLJ VIDEO:  Biden Admin Shut Down Covid Origin Investigation,2021-05-26T19:58:50Z
488,"I'm sticking with Americans Front Line Doctors. These Doctors are putting their reputations at risk by not advising people to get the vaccine. Yet, they are still doing it.",2021-05-26T19:49:54Z
489,"So, there is no greater percentage of people who get this condition in people who are vaccinated, than people who aren't vaccinated. Talk about a bullshit fear mongering piece and judging from the responses, its giving the antivaxx dolts ammunition, when it amounts to absolutely nothing.",2021-05-26T19:45:25Z
490,"✝️Im not trying to be a spammer or force my religion,✝️but we are in the end times right now✝️you see all over social media its a trend to worship the devil✝️and people think its a party in hell✝️but its not you will be in unbearable pain for all of eternity✝️please before its to late turn to God build a relationship with him repent from your sins✝️ask God for forgiveness, and know that✝️Jesus loves you, he died for you accept him into your heart✝️and as your lord and savior✝️and you will have eternal life with him✝️Thank you for reading.✝️ Romans 10:9 that if you confess with your mouth Jesus as Lord, and believe in your heart that God raised Him from the dead, you will be saved;",2021-05-26T19:40:34Z
491,Take the Fizur Jab and you're fooked.  Snake oil medicine trials on humans.  CDC's junk is bunk.,2021-05-26T19:11:56Z
492,"Uh, are we sure the heart issues aren't being caused by all those Tide pods? 😂😂😂",2021-05-26T19:11:30Z
493,Did yall forget you only supposed  to fear God. Instead  of a devil vaccine  made by devils to sheeps,2021-05-26T18:58:18Z
494,Wow the bxtch ass cdc gone investigate . Wow how that's gone help by doing that .and these people/ sheep  glad to do things we use to do. Lost people,2021-05-26T18:41:41Z
495,Great I just got the vaccine yesterday,2021-05-26T18:33:27Z
496,This is another way to get money from soon to become heart transplant patients. 🧐,2021-05-26T18:32:24Z
497,"""Safe and effective""",2021-05-26T18:29:31Z
498,If many of us 'dummies ' knew of heart inflammation with this vaccine...a long time ago...they surely must have known !,2021-05-29T15:55:16Z
499,"Flu vaccines are only about 60% effective and people take them yearly. Flu vaccines have rare neurologic side effects too that may paralyse you but people still take their flu shots. I don't see this is being any worse. 
Myocarditis happens with or without vaccines. 2 % of autopsies of sudden teenage deaths find myocarditis.",2021-05-27T17:52:31Z
500,Some kids ignore systems so they might not let their mom or guardian until its to late,2021-05-26T05:22:30Z
501,"Death by skydiving without a parachute w/ c0vid---> c0vid death
Death just after getting the shot ---> """"""just a coincidence""""""",2021-05-25T19:10:34Z
502,"If I die before I wake. I pray to the lord, my soul to take.",2021-05-25T18:51:08Z
503,Corona virus live update https://youtu.be/xBaNPTDChGY,2021-05-25T18:15:24Z
504,"What The News Isn’t Telling You Right Now👇
https://www.youtube.com/watch?v=X2M-qpUuvRo",2021-05-25T13:19:52Z
505,"Mainstream media in the US won't even call Christmas, Christmas. How can they trusted with this.",2021-05-25T11:27:15Z
506,Anyone injecting children with the HIV Covid19 vaccine needs to be tried for crimes against children.,2021-05-25T11:04:20Z
507,"https://youtu.be/plfh2IdruLs

Real story",2021-05-25T07:25:14Z
508,"Of this guy were my kids pediatrician and I  heard him say this, we’d be finding another doctor.",2021-05-25T02:14:46Z
509,"F you, no ones sticking that creepy questionable crap into my kids arm let alone myself.",2021-05-25T02:12:12Z
510,A small number is all they're willing to disclose.,2021-05-25T02:01:26Z
511,"This is not a rare problem. The government is trying to cover it up. As more and more innocent kids get the gene therapy jabs, we will see a huge rise in these inflammation cases, leading to multiple deaths. Just watch.",2021-05-24T21:07:53Z
512,"I can't believe people watch this trash, I just wanted to see how the lying sob's twist it!!! Keep watching sheep you can get on the train real soon!! SMFH",2021-05-24T19:50:10Z
513,Any cases are one too many. Your talking about people’s lives. So they are considering some people Casualties?  Why are they pushing this vaccine 💉 the jab? They aren’t telling people everything!,2021-05-24T17:57:18Z
514,Excuses excuses excuses! These vaccines has not been tested long enough and we do not know what the side effects will be long-term,2021-05-24T17:33:46Z
515,My point is why was this not set up front before they start screaming to have the children vaccinated?,2021-05-24T17:32:23Z
516,So they still want to vaccinate children even though it can cause heart problems and they do not know the long-term effects? This is a shitshow because the new variant kills very quickly if you're not vaccinated so that leaves all of our children 12 and below at risk and they don't seem to care about that because we are dropping the mask mandate.,2021-05-24T17:31:08Z
517,"""...CDC Probe Of Rare Heart Inflammation In (Covid) Vaccinated Teens"" motivates us, the people of America, to redouble our efforts to rapidly find out at any given moment, including even while On-Line, who among us are unwittingly contagious (i.e. pre-symptomatic or asymptomatic) in order to #ConvinceItForward for them to call their doctor and to self-quarantine per CDC guidelines in hopes of stopping this pandemic instead of having more #MourningInAmerica. Thus, we're hoping for the best while preparing for the worse-case scenario of the B.1.1.7 lineage mutations and others like the P.1, B.1.135, B.1.351, B.1.429, B.1.525, & B.1.617.1-3 lineage mutations combining to render current COVID vaccines no longer effective.",2021-05-24T17:05:39Z
518,"Thank You Father God for Your amazing love and grace. I pray that you meet the needs of anyone reading this comment, help them to choose you till you return In Jesus name I pray. Amen.",2021-05-24T16:47:29Z
519,Heart inflammation and palpitations are a very common side effect of the vaccine among ALL ages of people taking it.,2021-05-24T16:47:15Z
520,The loss of 100's of children is a LIE,2021-05-24T15:48:46Z
521,"The Brit doctors think it is related. But, this unemployed doctor is better than them surely. This guy is rich and white! Trust him. C'mon man!",2021-05-24T15:36:55Z
522,Coronavirus ends juliy 1 2021 😊,2021-05-24T14:51:58Z
523,Alternative media is saying do not take the vaccine...they are right.,2021-05-24T14:31:30Z
524,Mainstream media will bury this story by Wednesday,2021-05-24T14:29:31Z
525,Issues with the vaccine?  No couldn't be they said it was safe 😆,2021-05-24T14:25:17Z
526,Is it a small number if it happens to your kid?,2021-05-24T14:15:44Z
