,comments,dateStamp
689,another typo in the headlines,2021-05-26T20:40:28Z
690,*PLANDEMIC*,2021-05-26T20:30:45Z
691,that's like injecting cyberpunk2077 into your body lol,2021-05-26T18:15:04Z
692,"1 Corinthians 14:33
For God is not the author of confusion, but of peace, as in all churches of the saints.",2021-05-26T17:30:28Z
693,CDC is raping this nation ✔️,2021-05-26T17:20:15Z
694,"The adverse reactions are normal, line up folks! Could be dying from the jab is the least of your worries.",2021-05-26T16:16:48Z
695,Fauci has to testify in front of congress. Guess who is going to jail for crimes against humanity !!! Him and 'ol Billy boy don't have much time left. Bill is hiding his money with Melinda or she has given up on the charade and wants her life back since Bill is a p ed0 file and went to Epstein Island on many occasions. They are all going down !,2021-05-26T16:13:12Z
696,"CDC: No worries, they're young and can take it.",2021-05-26T16:12:38Z
697,How many “rare cases” of vaccine negative effects does it take to be not so rare...? How long until people get educated and inform themselves?,2021-05-26T14:29:55Z
698,"""investigates""",2021-05-26T14:25:16Z
699,This is racist,2021-05-26T13:29:23Z
700,The center for division corporation(cdc) is an alphabet agency put there to deceive the public.,2021-05-26T12:48:35Z
701,What's at stake when you get jabbed!!(( this vaccine IS NOT SAFE,2021-05-26T11:23:43Z
702,Not covid: WUHAN!,2021-05-26T09:32:45Z
703,You can't speak the truth anymore.  They call you a conspiracy theorists.  Investigate this. The United states was formed as a corporation in 1871. We actually live in a capitalist country. That within itself should speak volumes,2021-05-26T08:25:13Z
704,My Body My Choice no jab today no jab Tomorrow no jab ever,2021-05-26T06:13:30Z
705,Stop lying!,2021-05-26T05:23:07Z
706,thats what happens when companies that make defective baby powder and dish soap make vaccines.. losers,2021-05-26T04:51:18Z
707,Not as rare as you think...,2021-05-26T03:05:45Z
708,It's only rare because the pharmaceutical companies just created it,2021-05-26T02:59:02Z
709,"""Just several dozens""",2021-05-26T02:40:23Z
710,"🚗car crash🤔covid🛴scooter accident 🤔covid everything = covid, bunch of sheep🐑🐑🐑🐑being fed by the wolves🐩",2021-05-26T02:28:22Z
711,"Lol you are now normalizing myocarditis?  I just did a quick Vaers search and I found1496 distinct patients whose cases mention myocarditis. Keep reinventing the word ""rare.'",2021-05-26T02:21:25Z
712,"Man Made Virus, Man Made Bad Vaccine",2021-05-26T02:14:06Z
713,https://youtu.be/W1CyMXURgGc video begins at 17 seconds,2021-05-26T02:01:55Z
714,#1 - It's not as rare as they are implying. #2 - Cases and deaths have dropped because they've lowered the cycles the tests are run at and have scaled back the number of deaths labeled as COVID.,2021-05-26T01:53:57Z
715,What about the people who are becoming magnetic?,2021-05-26T01:16:03Z
716,They are giving your children shots without your knowledge or consent. Let that sink in.,2021-05-26T00:39:27Z
717,"Yeah, it's NOT rare in this poison shot.  If you look at the true numbers of people who have had complications and DEATH from this gene therapy (by definition it isn't a vaccine) it should never be used.  Ever.",2021-05-26T00:13:56Z
718,"""The Vax was Not brought in for Covid, Covid was brought in for the vax. Once you realize that, everything else makes sense"" - Dr Reiner Fuellmich. Attorney for Covid Crimes Against Humanity.",2021-05-26T00:04:09Z
719,"""If someone dies WITH covid-19, we are counting that."" -Direct quote from Dr. Birx at the Coronavirus Task Force press conference. You could literally make a stuffy nose the leading cause of death using this rule.",2021-05-26T00:02:46Z
720,"The Covid ""vaccine"" has never been approved, it's been authorized, an emergency authorization which puts it in the category of a medical experiment. (I don't take experiments) 

On December 11, 2020, the FDA issued an Emergency Use Authorization (EUA) for the use of the Pfizer-BioNTech COVID-19 Vaccine. On December 18, 2020, the FDA issued an EUA for the use of the Moderna COVID-19 Vaccine. And on February 27, 2021 the FDA issued an EUA for the use of the Janssen COVID-19 Vaccine. The issuance of an EUA is different than an FDA approval (licensure) of a vaccine.",2021-05-26T00:01:36Z
721,BLACKS MEXICANS AND NATIVE AMERICANS 12 TRIBES OF ISRAEL WE ARE GOD CHOSEN PEOPLE THE REAL HEBREW ISRAELITES OF THE BIBLE,2021-05-25T23:42:14Z
722,"Right, it's ""rare"".
And the CDC hasn't lied about the death rate (95% of Covid deaths were due to comorbidities, source: CDC) or exaggerated the infection rate (overreporting PCR tests, source WHO/CDC) either.",2021-05-25T23:40:22Z
723,"Pay careful attention to the new signs placed at business fronts, they say masks are recommended and some say please wear them. California anyway. I’ve chosen to not wear it and not a word was said.",2021-05-25T23:35:59Z
724,"I wish people would think for themselves, it’s just common sense to me not to take a vaxxine that’s only been out for 5 or so months, I mean what’d you expect, pharmaceutical companies aren’t liable for any damages. HUGE red flag. Our water, gmo’s in our food, deodorant, bath wash, it’s all designed to give us cancers and unhealthy so we take prescription pills and more and more. It’s sad",2021-05-25T23:17:45Z
725,"12K views, just over 200 votes... hmmmm",2021-05-25T22:52:07Z
726,disgusting for parents to let your child get this bullcrap,2021-05-25T22:32:00Z
727,When can they be held liable?,2021-05-25T22:28:41Z
728,Mainstream media never defines the word case I guess when they use the word it means someone tested positive covid-19,2021-05-25T22:23:42Z
729,"If only they went out their way to cure aids, cancer, and diabetes. But that brings in too much money.",2021-05-25T22:13:11Z
730,It's not rare.   Lying to you you. Give it time and you'll regret taking that posion shot,2021-05-25T22:11:38Z
731,It’s working exactly how it was designed.,2021-05-25T21:37:48Z
732,Bs propaganda.All liars and drug pushers.,2021-05-25T21:22:27Z
733,"Joshua 24:14-33 
14 Now therefore fear the Lord, and serve him in sincerity and in truth: and put away the gods which your fathers served on the other side of the flood, and in Egypt: serve ye the Lord. 
15 And if it seem evil unto you to serve the Lord, choose you this day whom ye will serve; whether the gods which your fathers served that were on the other side of the flood, or the gods of the amorites, in whose land ye dwell: but as for me and my house, we will serve the Lord. 
16 And the people answered and said, God forbid that we should forsake the Lord, to serve other gods; 
17 For the Lord our God, he it is that brought us up and our fathers out of the land of Egypt, from the house of bondage, and which did those great signs in our sight, and preserved us in all the way wherein we went, and among all the people through whom we passed: 
18 And the Lord drove out from before us all the people, even the Amorites which dwelt in the land: therefore will we also serve the Lord; for he is our God. 
19 And Joshua said unto the people, Ye cannot serve the Lord: for he is a holy God; he is a jealous God; he will not forgive your transgressions nor your sins. 
20 If ye forsake the Lord, and serve strange gods, then he will turn and do you hurt, and consume you, after that he hath done you good. 
21 And the people said unto Joshua, Nay: but we will serve the Lord. 
22 And Joshua said unto the people, Ye are witnesses against yourselves that ye have chosen you the Lord, to serve him. And they said, We are witnesses. 
23 Now therefore put away, said he, the strange gods which are among you, and incline your heart unto the Lord God of Israel. 
24 And the people said unto Joshua, The Lord our God will we serve, and his voice will we obey. 
25 So Joshua made a covenant with the people that day, and set them a statute and an ordinance in Shechem. 
26 And Joshua wrote these words in the book of the law of God, and took a great stone, and set it up there under an oak, that was by the sanctuary of the Lord. 
27 And Joshua said unto all the people, Behold, this stone shall be a witness unto us; for it hath heard all the words of the Lord which he spoke unto us: it shall be therefore a witness unto you, lest ye deny your God. 
28 So Joshua let the people depart, every man unto his inheritance. 
29 And it came to pass after these things, that Joshua the son of Nun, the servant of the Lord, died, being a hundred and ten years old. 
30 And they buried him in the border of his inheritance in Timnath-serah, which is in mount Ephraim, on the north side of the hill of Gaash. 
31 And Israel served the Lord all the days of Joshua, and all the days of the elders that over lived Joshua, and which had known all the works of the Lord, that he had done for Israel. 
32 And the bones of Joseph, which the children of Israel brought up out of Egypt, buried they in Shechem, in a parcel of ground which Jacob brought of the sons of Hamor the father of Shechem for a hundred pieces of silver: and it became the inheritance of the children of Joseph. 
33 And Eleazar the son of Aaron died; and they buried him in a hill that pertained to Phinehas his son, which was given him in mount Ephraim.",2021-05-25T21:02:35Z
734,"Galatians Chapter 2 
1 Then fourteen years after I went up again to Jerusalem with Barnabas, and took Titus with me also. 
2 And I went up by revelation, and communicated unto them that gospel which I preach among the Gentiles, but privately to them which were of reputation, lest by any means I should run, or had run, in vain. 
3 But neither Titus, who was with me, being a Greek, was compelled to be circumcised: 
4 And that because of false brethren unawares brought in, who came in privily to spy out our liberty which we have in Christ Jesus, that they might bring us into bondage: 
5 To whom we gave place by subjection, no, not for an hour; that the truth of the gospel might continue with you. 
6 But of these who seemed to be somewhat, (whatsoever they were, it maketh no matter to me: God accepteth no man’s person) for they who seemed to be somewhat in conference added nothing to me: 
7 But contra wise, when they saw that the gospel of the uncircumcision was committed unto me, as the gospel of the circumcision was unto Peter; 
8(For he that wrought effectually in Peter to the apostleship of the circumcision, the same was mighty in me toward the Gentiles) 
9 And when James, Cephas, and John, who seemed to be pillars, perceived the grace that was given unto me, they gave to me and Barnabas the right hands of fellowship; that we should go unto the heathen, and they unto the circumcision. 
10 Only they would that we should  remember the poor: the same which I also was forward to do. 
11 But when Peter was come to Antioch, I withstood him to the face, because he was to be blamed. 
12 For before that certain came from James, he did eat with the Gentiles: but when they were come, he withdrew and separated himself, fearing them which were of the circumcision. 
13 And the other Jews dissembled likewise with him; insomuch that Barnabas also was carried away with their dissimulation. 
14 But when I saw that they walked not uprightly according to the truth of the gospel, I said unto Peter before them all, if thou, being a Jew, livest after the manner of Gentiles, and not as do the Jews, why compellest thou the Gentiles to live as do the Jews? 
15 We who are Jews by nature, and not sinners of the Gentiles, 
16 Knowing that a man is not justified by the works of the law, but by the faith of Jesus Christ, even we have believed in Jesus Christ, that we might be justified by the faith of Christ, and not by the works of the law: for by the works of the law shall no flesh be justified. 
17 But if, while we seek to be justified by Christ, we ourselves also are found sinners, is therefore Christ the minister of sin? God forbid. 
18 For if I build again the things which I destroyed, I make myself a transgressor. 
19 For I through the law am dead to the law, that I might live unto God. 
20 I am crucified with Christ: nevertheless I live; yet not I, but Christ liveth in me: and the life which I now live by the faith of the Son of God, who loved me, and gave himself for me. 
21 I do not frustrate the grace of God: for if righteousness come by the law, then Christ is dead in vain.",2021-05-25T21:02:18Z
735,"Galatians Chapter 2 
1 Then fourteen years after I went up again to Jerusalem with Barnabas, and took Titus with me also. 
2 And I went up by revelation, and communicated unto them that gospel which I preach among the Gentiles, but privately to them which were of reputation, lest by any means I should run, or had run, in vain. 
3 But neither Titus, who was with me, being a Greek, was compelled to be circumcised: 
4 And that because of false brethren unawares brought in, who came in privily to spy out our liberty which we have in Christ Jesus, that they might bring us into bondage: 
5 To whom we gave place by subjection, no, not for an hour; that the truth of the gospel might continue with you. 
6 But of these who seemed to be somewhat, (whatsoever they were, it maketh no matter to me: God accepteth no man’s person) for they who seemed to be somewhat in conference added nothing to me: 
7 But contra wise, when they saw that the gospel of the uncircumcision was committed unto me, as the gospel of the circumcision was unto Peter; 
8(For he that wrought effectually in Peter to the apostleship of the circumcision, the same was mighty in me toward the Gentiles) 
9 And when James, Cephas, and John, who seemed to be pillars, perceived the grace that was given unto me, they gave to me and Barnabas the right hands of fellowship; that we should go unto the heathen, and they unto the circumcision. 
10 Only they would that we should  remember the poor: the same which I also was forward to do. 
11 But when Peter was come to Antioch, I withstood him to the face, because he was to be blamed. 
12 For before that certain came from James, he did eat with the Gentiles: but when they were come, he withdrew and separated himself, fearing them which were of the circumcision. 
13 And the other Jews dissembled likewise with him; insomuch that Barnabas also was carried away with their dissimulation. 
14 But when I saw that they walked not uprightly according to the truth of the gospel, I said unto Peter before them all, if thou, being a Jew, livest after the manner of Gentiles, and not as do the Jews, why compellest thou the Gentiles to live as do the Jews? 
15 We who are Jews by nature, and not sinners of the Gentiles, 
16 Knowing that a man is not justified by the works of the law, but by the faith of Jesus Christ, even we have believed in Jesus Christ, that we might be justified by the faith of Christ, and not by the works of the law: for by the works of the law shall no flesh be justified. 
17 But if, while we seek to be justified by Christ, we ourselves also are found sinners, is therefore Christ the minister of sin? God forbid. 
18 For if I build again the things which I destroyed, I make myself a transgressor. 
19 For I through the law am dead to the law, that I might live unto God. 
20 I am crucified with Christ: nevertheless I live; yet not I, but Christ liveth in me: and the life which I now live by the faith of the Son of God, who loved me, and gave himself for me. 
21 I do not frustrate the grace of God: for if righteousness come by the law, then Christ is dead in vain.",2021-05-25T20:59:49Z
736,"My niece was complaining about this after getting second dose , so I know it’s for real .",2021-05-25T20:56:13Z
737,"The most censored documentary on the internet...
*Europa: The Last Battle*
Use DuckDuckGo. Find it. Watch it.",2021-05-25T20:52:56Z
738,"""a small number"".  Per the CDC, over 4,600 Americans have died after being injected with China Virus vaccine.  So, per the CDC, 4,600+ dead is ""a small number"".
Dr. Faustus and the CDC have changed their ""expert"" opinions on China Virus so many times it's like watching a tennis match.  Now they hope you won't notice this.
Something _not_ reported by the Leftist Propaganda Media : _over 4,600 Americans have died after getting the China Virus vaccine_ .  That's from the CDC.
A small percentage, but not insignificant - particularly not insignificant to the families of over 4,600 Americans who have died.

This is not from a ""right-wing"" source - it's from the CDC itself.  The CDC had to publish because they see what Gov. Cuomo got himself into by hiding public information.
- ""Over 259 million doses of COVID-19 vaccines were administered in the United States from December 14, 2020, through May 17, 2021.
    During this time, VAERS received 4,647 reports of death (0.0017%) among people who received a COVID-19 vaccine. ""
    https://www.cdc.gov/coronavirus/2019-ncov/vaccines/safety/adverse-events.html

""Illegal aliens don't carry China Virus.  They don't even get it, not at all.  Something about the water in the Rio Grande...
  So putting them in buses and dumping them randomly in communities across the country isn't the mother of all super-spreader events.""
- illegitimate President Joe ""you ain't Pasteur"" Biden",2021-05-25T20:34:33Z
739,"Dont worry everyone, the mRNA shots just only killed 100% of the ferret test subjects when testing these shots in 1.5 years; you made the right choice. lol",2021-05-25T19:18:52Z
740,"Vaccine pushers will lie and say ""safe and effective""  Line your kiddos up sheep!  They need to join the herd.  Obey!",2021-05-25T17:49:04Z
741,"I’m 20 and healthy and got my vaccine in February/March. This is exactly what happened to me, very scary stuff. Ended up going to the emergency room because I was worried I was having a heart attack.",2021-05-25T16:13:53Z
742,"Crazy. Parents. But we see how well ""parents"" have brought up their children. Lack of education..sooo many with zero education, but having a ton of kids and voting? And ""thinking"" Youth needs to be vaccinated with a ""test"" protein spiked, never been used before, vaccine method.  Yup, real smart. Unless there is HIGH risk for not taking it, an experimental drug should not be taken. But the Sheeple insist.",2021-05-25T14:12:08Z
743,"Minor chance of problems from new vaccine: no big deal.
Minor chance of catching covid: LOCKDOWN THE WORLD",2021-05-25T14:10:54Z
744,"So far, 18 children in Connecticut alone have been hospitalized for heart inflammation. Is this a ""small number"", for a condition that is ordinarily very rare?  How many reports throughout the country at this point have there been...hundreds? ""Several dozens"" is an evasive way of not giving actual numbers. Even if these cases are considered ""mild"", what are the long-term effects of having had inflammation of the heart at an early age? Is this an acceptable risk for a virus that so few children have serious problems with?  Apparently, I have many questions that this media outlet will likely not answer. Article about the cases in CT: https://www.wtnh.com/news/health/coronavirus/could-the-covid-vaccine-enlarge-hearts-in-children-more-than-a-dozen-hospitalized-in-ct-cdc-investigating/",2021-05-25T10:10:36Z
745,I don't trust it for my kid,2021-05-25T04:39:14Z
746,This has to do with the heart! How can it not be serious! I have no words..,2021-05-25T00:52:11Z
747,May God bless her and her family I hope she feels better soon🙏🏽✝️❤️❤️,2021-05-25T00:10:33Z
748,"US Covid deaths 604,365   New Zealand 26.
The numbers don't lie.
Stop blaming China and the WHO simple 3 point plan. 
How more simple did it have to be for Americans to understand?",2021-05-25T00:07:55Z
749,"We live in a generation where teasing and laughing at Americans is the norm.
MAGATs, Anti-maskers and Anti-Vaxxers who never wear masks are now pretending they're inoculated.
Over 11 days in Israel, 230 Palestinians and 12 Israelis died which isn't even half the 600 daily US Covid death toll. 
Covid deaths US 604,365   India 307,249   Mexico 221,647   Canada 25,242   China 4,636   Australia 910   Taiwan 29   NZ 26.",2021-05-25T00:07:42Z
750,"""Several dozen"" kids have had adverse reactions yet no one ""pauses"" the Pfizer vaccine.  But 6 women have bloot clots and they halt J&J.",2021-05-24T23:57:48Z
751,This is crazzzzzzy🤦🏾‍♀️,2021-05-24T21:34:04Z
752,"I don’t care even if one person gets this issue, i am worried if that person is me",2021-05-24T21:30:11Z
753,Only small number of cases. We need more sheep 🐑 to join !! Let’s go.,2021-05-24T21:21:29Z
754,At this point they are poisoning people on purpose 😅,2021-05-24T20:09:52Z
755,Liars.,2021-05-24T19:57:08Z
756,"The world today has 6.8 billion people. That's headed up to about nine billion. Now, if we do a really great job on new vaccines, health care, reproductive health services, we could lower that by, perhaps, 10 or 15 percent.

- Bill Gates  ( February  2010 )",2021-05-30T09:45:06Z
757,"This happened to a member of my family he got his second shot and had to go to the hospitol a couple days later, They said it was heart inflammation.",2021-05-29T23:33:38Z
758,You POS sheeple deserves what you get.   We tried to tell you.,2021-05-29T19:14:43Z
759,"I got my 14yr old son vaccinated and Yesterday my son got dizzy,blurry vision and blacked out at school. He was unresponsive for at least 10mins. He had an ECG, blood work, etc. Turns out he has inflammation around his heart because of the vaccine. Please monitor your kids closely.  No child should have to experience this.",2021-05-29T14:42:49Z
760,If you've already had the virus and have proteins already you don't need the vaccine they're already talkin about a booster and that  means that the vaccine is no better than your own immune system,2021-05-29T00:51:05Z
761,Stick your socialism in your ass this is a bunch of lying bullshit quit buying into this shit people,2021-05-28T17:54:15Z
762,"I DONT EVEN UNDERSTAND HOW THESE PARENTS JUST DID THAT WIRH THEIR KIDS SO EASILY. U DONT KNOW IF LONG TERM IT MAY MESS WITH THEIR REPRODUCTION! THEY TRYING TO STOP REPRODUCTION TOO, BELIEVE THAT! AS WE GO THEY ARE SHOWING PROOF THIS SHYTE WAS MADE IN A LAB AND NOT NATURAL. NOW THE VACS ARE MADE IN A LAB TOO. ...SOOO.  ... LAB RATS",2021-05-28T13:48:27Z
763,IF IT WAS NOT UNEXPECTED WHY THE HELL DIDNT YALL SAY SOMETHIN ABOUT THE POSSIBILITY OF IT B4 APPROVING KIDS TO TAKE IT?! THATS THAT GUINNIE PIG SHYTE,2021-05-28T13:39:01Z
764,"Teens 99.9% recovery rate. Get the jab and suffer lifelong heart problems, but this bozo said COVID is deadly, so get the jab.",2021-05-28T02:41:02Z
765,"""safe and effective"".",2021-05-27T21:50:52Z
766,Video on covid vaccine retractable needles and more mark of the beast? https://youtu.be/FPgVVCcDFyk,2021-05-27T20:48:57Z
767,Trick no good to put it in plain language,2021-05-27T14:02:13Z
768,Not for my kids,2021-05-27T14:01:07Z
769,No liability for the vaccine pushers!  Parents get to pay to treat the damages to their kids. Get in line lab rats!,2021-05-27T13:54:05Z
770,Don't take this poison,2021-05-27T13:32:30Z
771,This dude has made $6 BILLION as a dr??? Could it be that endorsing the authenticity of the Scamdemic may further line his pockets??  Follow the money!,2021-05-27T11:45:49Z
772,"I have no pity for these people, we warned them about the effects of the jab, showed them videos about the ordeal of people who got the jab. But they said it was all conspiracy theory and anti-vaxx propaganda.",2021-05-27T02:10:12Z
773,"Okay I got first shot of mordena and 4 days after I had diarrhea and at the same time I was throwing up and I had on set sweaty like dripping nauseous clammy feeling, I felt like I was gonna pass out this alll happen at the same time I felt weak after I mostly slept I looked up the Symptoms it said like heart attack or stoke but exactly one day after  this information came out , and I’m 19 soooo little worried should I be worried should I go get checked out ?? Or is this normal ? Please answer back if anyone has advice",2021-05-26T19:21:57Z
774,GENE THERAPY IS NOT A VACCINATION .,2021-05-26T10:59:27Z
775,What idiots would vaccinate their child with an experimental gene therapy,2021-05-26T06:40:45Z
776,These people are evil making kids take this vaccine.  Now look what you did you gave them heart issues bravo 👏,2021-05-26T03:19:36Z
777,Lethal injections. Now they want to murder your children. If you already took covid vax your fucked. I guess they don’t want to their children to be orphans so take them to grave with them,2021-05-26T01:30:25Z
778,Should all the adult get vaccinated and protected first. Why do we need our kids to protect us? We should be the one to protect them? Most of the case the kids with covid has no symptoms or not deadly to them.,2021-05-26T00:58:29Z
779,Everyone injecting children with the HIV Covid19 vaccine needs to be tried for crimes against children.,2021-05-25T10:40:11Z
780,Thank you for participation in the experimental vaccine.   The virus is not deadly to kids.  There is no evidence of that.,2021-05-25T08:48:47Z
781,What exactly is a few kids? One out of every 10 kids that's a few is it?,2021-05-25T06:45:22Z
